{
  "schema_version": "1",
  "flow_name": "mocked-post-deployment-smoke",
  "network": "testnet",
  "contract_id": "CONTRACT_ID_PLACEHOLDER",
  "initialization_summary": {
    "admin_address": "ADMIN_PUBKEY_PLACEHOLDER",
    "deposit_token": "DEPOSIT_TOKEN_CONTRACT_ID_PLACEHOLDER",
    "reward_token": "REWARD_TOKEN_CONTRACT_ID_PLACEHOLDER",
    "loaded_from": "examples/vault-initialization-input.json"
  },
  "lifecycle_stages": [
    {
      "stage_index": 1,
      "stage_name": "contract_id_loading",
      "status": "PASSED",
      "checks": [
        {
          "check": "registry_resolution",
          "result": "CONTRACT_ID_PLACEHOLDER",
          "expected": "CONTRACT_ID_PLACEHOLDER"
        },
        {
          "check": "contract_id_format_valid",
          "result": true,
          "expected": true
        }
      ]
    },
    {
      "stage_index": 2,
      "stage_name": "initialization_input_loading",
      "status": "PASSED",
      "checks": [
        {
          "check": "init_schema_version",
          "result": "1",
          "expected": "1"
        },
        {
          "check": "admin_address_format_valid",
          "result": true,
          "expected": true
        },
        {
          "check": "deposit_token_format_valid",
          "result": true,
          "expected": true
        },
        {
          "check": "reward_token_format_valid",
          "result": true,
          "expected": true
        }
      ]
    },
    {
      "stage_index": 3,
      "stage_name": "read_verification",
      "status": "PASSED",
      "checks": [
        {
          "check": "is_initialized",
          "result": true,
          "expected": true
        },
        {
          "check": "initial_total_deposits",
          "result": 0,
          "expected": 0
        },
        {
          "check": "initial_reward_balance",
          "result": 0,
          "expected": 0
        }
      ]
    },
    {
      "stage_index": 4,
      "stage_name": "deposit_accounting_simulation",
      "status": "PASSED",
      "checks": [
        {
          "check": "simulated_deposit_event",
          "result": "vault/deposit",
          "expected": "vault/deposit"
        },
        {
          "check": "user_balance_after_deposit",
          "result": 1000,
          "expected": 1000
        },
        {
          "check": "total_deposits_after_deposit",
          "result": 1000,
          "expected": 1000
        }
      ]
    },
    {
      "stage_index": 5,
      "stage_name": "reward_and_claim_simulation",
      "status": "PASSED",
      "checks": [
        {
          "check": "pending_rewards_calculated",
          "result": 250,
          "expected": 250
        },
        {
          "check": "simulated_claim_event",
          "result": "vault/claim",
          "expected": "vault/claim"
        },
        {
          "check": "user_balance_after_withdrawal",
          "result": 0,
          "expected": 0
        }
      ]
    }
  ],
  "overall_status": "PASSED",
  "maintainer_smoke_boundary": {
    "no_live_rpc_used": true,
    "secrets_exposed": false
  }
}
